{
  "name": "process-improvement",
  "version": "0.3.0",
  "description": "Lean Six Sigma process-improvement team — specialist agents (lean-six-sigma-blackbelt, process-analyst) that analyze a team's operational processes and improve them with Black-Belt rigor: DMAIC, Lean waste removal (the 8 wastes / DOWNTIME), data-proven root-cause analysis, statistical process control, and control plans that make the gain stick. Domain-neutral (support, onboarding, billing, deployment, hiring — any process). skills, templates, best-practices, a stdlib calculator (Cp/Cpk/Ppk, sigma-level/DPMO, I-MR limits, COPQ), a control-then-capability triage command, an advisory anti-pattern hook, a scenarios bank, and a knowledge bank with web-verified Mermaid decision trees (sigma/DPMO, Cp/Cpk, control-chart selection, common-vs-special-cause response, capability-fix, WE/Nelson rules). The inferential statistics seam (hypothesis tests, DOE, regression, Gage R&R) routes to applied-statistics; DMAIC project delivery routes to project-management. Requires ravenclaude-core@>=0.7.0.",
  "author": {
    "name": "Matt Corbett"
  },
  "homepage": "https://github.com/mcorbett51090/RavenClaude",
  "license": "MIT",
  "keywords": [
    "process-improvement",
    "lean",
    "six-sigma",
    "lean-six-sigma",
    "dmaic",
    "black-belt",
    "spc",
    "control-chart",
    "process-capability",
    "cpk",
    "root-cause-analysis",
    "kaizen",
    "value-stream-mapping",
    "fmea",
    "continuous-improvement"
  ],
  "requires": {
    "plugins": ["ravenclaude-core@>=0.7.0"]
  }
}
