{
  "name": "k12-school-administration",
  "version": "0.1.2",
  "description": "K-12 School Administration specialist team — agents (school-administration-lead, enrollment-attendance-analyst, staffing-budget-specialist, student-outcomes-specialist), skills, templates, commands, an advisory hook, best-practice rules, and a research-grounded knowledge bank. An administration team for a principal, business manager, or district administrator accountable for enrollment, budget, and student outcomes — it manages enrollment as a funded pipeline, reads attendance/ADA as funding and an outcome signal, fits staffing to the budget envelope, flags chronic absenteeism early, and reads outcomes segmented. Inherits ravenclaude-core protocols.",
  "author": {
    "name": "Matt Corbett"
  },
  "homepage": "https://github.com/mcorbett51090/RavenClaude",
  "license": "MIT",
  "keywords": [
    "k12",
    "school-administration",
    "enrollment",
    "ada",
    "per-pupil-funding",
    "staffing-ratio",
    "chronic-absenteeism",
    "student-outcomes",
    "ferpa"
  ],
  "requires": {
    "plugins": ["ravenclaude-core@>=0.7.0"]
  }
}
